{
  "schema_version": 1,
  "id": "issue-101-validation-evidence-methods",
  "summary": "Map validation assertions to explicit evidence actions, observation boundaries, evaluator capability, coverage, reproducibility, and truthful non-pass states.",
  "category": "added",
  "audiences": ["developers", "stakeholders"],
  "components": ["lifecycle-engine", "product"],
  "issues": [83, 101, 102, 103, 108],
  "breaking": false,
  "internal_only": false
}
