{
  "schema_version": 1,
  "id": "issue-30-native-support",
  "summary": "Qualify equivalent Phase 1 lifecycle semantics on native Linux, macOS, and Windows runners.",
  "category": "added",
  "audiences": ["users", "operators", "developers", "stakeholders"],
  "components": ["ci", "engine"],
  "issues": [30],
  "breaking": false,
  "internal_only": false
}
