{
  "schema_version": 1,
  "id": "issue-75-delivery-squash",
  "summary": "Deliver one governed Ready issue through exact-head gates, distinct review, mandated squash merge, and stable receipt-aware completion reconciliation.",
  "category": "added",
  "audiences": ["users", "operators", "developers", "stakeholders"],
  "components": ["cli", "engine", "github", "github-workflow"],
  "issues": [75, 116],
  "breaking": false,
  "internal_only": false
}
