{
  "schema_version": 1,
  "id": "issue-15-project-state-reconciliation",
  "summary": "Reconcile closed items, native parent progress, and direct dependencies through immutable lifecycle plans with before-and-after receipts.",
  "category": "fixed",
  "audiences": ["users", "operators", "developers"],
  "components": ["engine", "github-workflow"],
  "issues": [15],
  "breaking": false,
  "internal_only": false
}
