{
  "schema_version": 1,
  "id": "issue-46-roadmap-phase",
  "summary": "Governed Project Phase configuration with parent-derived child context, exact authority/catalog evidence, and truthful view support.",
  "category": "added",
  "audiences": ["users", "developers", "stakeholders"],
  "components": ["engine", "github-workflow"],
  "issues": [46],
  "breaking": false,
  "internal_only": false
}
