{
  "schema_version": 1,
  "id": "issue-74-govern-executable-work",
  "summary": "Govern executable work with source-bound freshness, subtype completion, independent Horizon projection, exact delivery evidence, and mandated external effects.",
  "category": "added",
  "audiences": ["users", "operators", "developers", "stakeholders"],
  "components": ["engine", "github", "github-workflow"],
  "issues": [74],
  "breaking": false,
  "internal_only": false
}
